<?xml version="1.0" encoding="UTF-8"?>
<application xmlns="http://java.sun.com/xml/ns/javaee"
             xmlns:xsi="http://www.w3.org/2001/XMLSchema-instance"
             version="5"
             xsi:schemaLocation="http://java.sun.com/xml/ns/javaee http://java.sun.com/xml/ns/javaee/application_5.xsd">
  <display-name>XPI REST Adapter Application</display-name>
  <module>
    <web>
      <web-uri>com.sap.aii.adapter.rest.war</web-uri>
      <context-root>RESTAdapter</context-root>
    </web>
  </module>
  <module>
    <ejb>com.sap.aii.adapter.rest.ejb.jar</ejb>
  </module>
</application>
